{
  "$schema": "../schemas/scenario-schema.json",
  "id": "scenario-template",
  "type": "video_edit",
  "version": "1.0.0",
  "description": "シナリオテンプレート (SAC=1)。scenarios/<id>/scenario.json にコピー後、id をディレクトリ名と一致させ各セクションを編集する。1 ディレクトリ追加で render-loop が自動検出することを実証する最小定義。",
  "input_sources": [
    {
      "type": "video_file",
      "path": "inputs/source.mp4",
      "required": true,
      "description": "入力動画 (シナリオに合わせて差し替え)"
    }
  ],
  "quality_gates": {
    "required_mechanical_gates": [
      {
        "id": "gate-output-exists",
        "description": "レンダリング結果ファイルが生成されていること",
        "command": "test -f out/output.mp4",
        "expect": "exit 0",
        "blocking": true
      }
    ],
    "human_checks": [
      {
        "id": "hc-visual-quality",
        "description": "出力動画の視覚品質に破綻がないこと (色ずれ/ブロックノイズ/音ずれ)"
      }
    ]
  },
  "agent_prompt_patch": "シナリオ固有の制約・ヒントをここに記述する (1 行〜数行)。例: 解像度 1920x1080 固定、ffmpeg のみ使用、HTTP API 呼出禁止。"
}
